{
  "id": "trd_f9e8d7c6-b5a4-3210-fedc-ba9876543210",
  "symbol": "AAPL",
  "entry_order": {
    "id": "ord_a1b2c3d4-e5f6-7890-abcd-ef1234567890",
    "type": "buy",
    "symbol": "AAPL",
    "qty": 10,
    "submitted_price": 189.42,
    "status": "filled",
    "filled_qty": 10,
    "filled_price": 189.50,
    "submitted_at": "2024-03-15T14:32:10Z",
    "updated_at": "2024-03-15T14:32:12Z"
  },
  "exit_order": {
    "id": "ord_b2c3d4e5-f6a7-8901-bcde-f12345678901",
    "type": "sell",
    "symbol": "AAPL",
    "qty": 10,
    "submitted_price": 191.00,
    "status": "filled",
    "filled_qty": 10,
    "filled_price": 190.95,
    "submitted_at": "2024-03-15T15:45:30Z",
    "updated_at": "2024-03-15T15:45:31Z"
  },
  "net_pl": 14.50,
  "label": "good",
  "opened_at": "2024-03-15T14:32:10Z",
  "closed_at": "2024-03-15T15:45:31Z"
}
